{
  "tool": "find",
  "version": "0.4.0",
  "status": "ok",
  "command": {
    "cmd": "find",
    "files": [],
    "dir": [
      "examples/basic"
    ],
    "filelist": [],
    "exclude": [],
    "single_unit": false,
    "pattern": "top.u_dp0.**",
    "regex": false,
    "kind": "all",
    "scope": null
  },
  "data": {
    "mode": "find",
    "pattern": "top.u_dp0.**",
    "regex": false,
    "kind": "all",
    "scope": "",
    "matches": [
      {
        "category": "instance",
        "name": "u_dp0",
        "kind": "Instance",
        "hierarchical_path": "top.u_dp0",
        "module": "datapath",
        "file": "./examples/basic/top.sv",
        "line": 60,
        "column": 14,
        "location": {
          "file": "./examples/basic/top.sv",
          "line": 60,
          "column": 14
        }
      },
      {
        "category": "signal",
        "name": "a",
        "kind": "Variable",
        "hierarchical_path": "top.u_dp0.a",
        "type": "logic[7:0]",
        "file": "./examples/basic/top.sv",
        "line": 33,
        "column": 24,
        "location": {
          "file": "./examples/basic/top.sv",
          "line": 33,
          "column": 24
        }
      },
      {
        "category": "signal",
        "name": "b",
        "kind": "Variable",
        "hierarchical_path": "top.u_dp0.b",
        "type": "logic[7:0]",
        "file": "./examples/basic/top.sv",
        "line": 34,
        "column": 24,
        "location": {
          "file": "./examples/basic/top.sv",
          "line": 34,
          "column": 24
        }
      },
      {
        "category": "signal",
        "name": "clk",
        "kind": "Variable",
        "hierarchical_path": "top.u_dp0.clk",
        "type": "logic",
        "file": "./examples/basic/top.sv",
        "line": 32,
        "column": 24,
        "location": {
          "file": "./examples/basic/top.sv",
          "line": 32,
          "column": 24
        }
      },
      {
        "category": "signal",
        "name": "q",
        "kind": "Variable",
        "hierarchical_path": "top.u_dp0.q",
        "type": "logic[7:0]",
        "file": "./examples/basic/top.sv",
        "line": 37,
        "column": 17,
        "location": {
          "file": "./examples/basic/top.sv",
          "line": 37,
          "column": 17
        }
      },
      {
        "category": "instance",
        "name": "u_alu",
        "kind": "Instance",
        "hierarchical_path": "top.u_dp0.u_alu",
        "module": "alu",
        "file": "./examples/basic/top.sv",
        "line": 45,
        "column": 9,
        "location": {
          "file": "./examples/basic/top.sv",
          "line": 45,
          "column": 9
        }
      },
      {
        "category": "signal",
        "name": "a",
        "kind": "Variable",
        "hierarchical_path": "top.u_dp0.u_alu.a",
        "type": "logic[7:0]",
        "file": "./examples/basic/top.sv",
        "line": 20,
        "column": 24,
        "location": {
          "file": "./examples/basic/top.sv",
          "line": 20,
          "column": 24
        }
      },
      {
        "category": "signal",
        "name": "b",
        "kind": "Variable",
        "hierarchical_path": "top.u_dp0.u_alu.b",
        "type": "logic[7:0]",
        "file": "./examples/basic/top.sv",
        "line": 21,
        "column": 24,
        "location": {
          "file": "./examples/basic/top.sv",
          "line": 21,
          "column": 24
        }
      },
      {
        "category": "instance",
        "name": "u_add",
        "kind": "Instance",
        "hierarchical_path": "top.u_dp0.u_alu.u_add",
        "module": "adder",
        "file": "./examples/basic/top.sv",
        "line": 24,
        "column": 24,
        "location": {
          "file": "./examples/basic/top.sv",
          "line": 24,
          "column": 24
        }
      },
      {
        "category": "signal",
        "name": "a",
        "kind": "Variable",
        "hierarchical_path": "top.u_dp0.u_alu.u_add.a",
        "type": "logic[7:0]",
        "file": "./examples/basic/top.sv",
        "line": 12,
        "column": 30,
        "location": {
          "file": "./examples/basic/top.sv",
          "line": 12,
          "column": 30
        }
      },
      {
        "category": "signal",
        "name": "b",
        "kind": "Variable",
        "hierarchical_path": "top.u_dp0.u_alu.u_add.b",
        "type": "logic[7:0]",
        "file": "./examples/basic/top.sv",
        "line": 13,
        "column": 30,
        "location": {
          "file": "./examples/basic/top.sv",
          "line": 13,
          "column": 30
        }
      },
      {
        "category": "signal",
        "name": "y",
        "kind": "Variable",
        "hierarchical_path": "top.u_dp0.u_alu.u_add.y",
        "type": "logic[7:0]",
        "file": "./examples/basic/top.sv",
        "line": 14,
        "column": 30,
        "location": {
          "file": "./examples/basic/top.sv",
          "line": 14,
          "column": 30
        }
      },
      {
        "category": "signal",
        "name": "y",
        "kind": "Variable",
        "hierarchical_path": "top.u_dp0.u_alu.y",
        "type": "logic[7:0]",
        "file": "./examples/basic/top.sv",
        "line": 22,
        "column": 24,
        "location": {
          "file": "./examples/basic/top.sv",
          "line": 22,
          "column": 24
        }
      },
      {
        "category": "instance",
        "name": "u_reg",
        "kind": "Instance",
        "hierarchical_path": "top.u_dp0.u_reg",
        "module": "register",
        "file": "./examples/basic/top.sv",
        "line": 39,
        "column": 27,
        "location": {
          "file": "./examples/basic/top.sv",
          "line": 39,
          "column": 27
        }
      },
      {
        "category": "signal",
        "name": "clk",
        "kind": "Variable",
        "hierarchical_path": "top.u_dp0.u_reg.clk",
        "type": "logic",
        "file": "./examples/basic/top.sv",
        "line": 2,
        "column": 30,
        "location": {
          "file": "./examples/basic/top.sv",
          "line": 2,
          "column": 30
        }
      },
      {
        "category": "signal",
        "name": "d",
        "kind": "Variable",
        "hierarchical_path": "top.u_dp0.u_reg.d",
        "type": "logic[7:0]",
        "file": "./examples/basic/top.sv",
        "line": 3,
        "column": 30,
        "location": {
          "file": "./examples/basic/top.sv",
          "line": 3,
          "column": 30
        }
      },
      {
        "category": "signal",
        "name": "q",
        "kind": "Variable",
        "hierarchical_path": "top.u_dp0.u_reg.q",
        "type": "logic[7:0]",
        "file": "./examples/basic/top.sv",
        "line": 4,
        "column": 30,
        "location": {
          "file": "./examples/basic/top.sv",
          "line": 4,
          "column": 30
        }
      },
      {
        "category": "signal",
        "name": "y",
        "kind": "Variable",
        "hierarchical_path": "top.u_dp0.y",
        "type": "logic[7:0]",
        "file": "./examples/basic/top.sv",
        "line": 35,
        "column": 24,
        "location": {
          "file": "./examples/basic/top.sv",
          "line": 35,
          "column": 24
        }
      }
    ],
    "match_count": 18
  },
  "diagnostics": [],
  "errors": [],
  "summary": {
    "mode": "find",
    "matches": 18,
    "signals": 14,
    "instances": 4,
    "truncated": false,
    "limit": 200
  }
}
